{
  "$schema": "https://json-schema.org/draft/2020-12/schema",
  "$id": "openmontage/artifacts/brief",
  "title": "Video Brief",
  "description": "Creative brief produced by the Idea Explorer agent.",
  "type": "object",
  "required": ["version", "title", "hook", "key_points", "tone", "style", "target_platform", "target_duration_seconds", "niche", "platform_title_style", "design_system", "beat_plan", "angle_options", "selected_angle", "candidate_count", "candidate_count_reason", "blacklist_check"],
  "properties": {
    "version": { "type": "string", "const": "1.0" },
    "title": { "type": "string", "minLength": 1 },
    "hook": { "type": "string", "description": "Opening hook / attention grabber" },
    "key_points": {
      "type": "array",
      "items": { "type": "string" },
      "minItems": 1
    },
    "core_message": { "type": "string" },
    "cta": { "type": "string", "description": "Call to action" },
    "tone": { "type": "string" },
    "style": { "type": "string", "description": "Style playbook name or custom description" },
    "target_audience": { "type": "string" },
    "target_platform": {
      "type": "string",
      "enum": ["youtube", "instagram", "tiktok", "linkedin", "bilibili", "xiaohongshu", "generic"]
    },
    "target_duration_seconds": { "type": "number", "minimum": 1 },
    "niche": {
      "type": "string",
      "description": "Selected documentary niche/domain, e.g., 'history', 'technology', 'money and power'"
    },
    "platform_title_style": {
      "type": "string",
      "enum": ["viral", "documentary", "brand"],
      "description": "Title style determined by target_platform. viral = curiosity-driven hooks; documentary = restrained documentary style; brand = brand-safe corporate style."
    },
    "reference_material": {
      "type": "array",
      "items": { "type": "string" },
      "description": "Paths or URLs to source material"
    },
    "angle_options": {
      "type": "array",
      "items": {
        "type": "object",
        "properties": {
          "name": { "type": "string" },
          "description": { "type": "string" },
          "hook": { "type": "string", "description": "Concrete hook: date, name, number, or place" },
          "style": { "type": "string", "enum": ["viral", "documentary", "brand"], "description": "Title style for this option" },
          "sub_niche": { "type": "string", "description": "Sub-niche tag to ensure no two options fall in the same sub-territory" }
        },
        "required": ["name", "description", "hook"]
      },
      "minItems": 1,
      "description": "Candidate video angles produced by the idea stage. Count is dynamic, not fixed."
    },
    "selected_angle": { "type": "string" },
    "candidate_count": {
      "type": "integer",
      "minimum": 1,
      "description": "Number of candidate angles actually generated"
    },
    "candidate_count_reason": {
      "type": "string",
      "description": "Human-readable reason for the chosen candidate count (e.g., 'high-breadth domain generated 25 options')"
    },
    "blacklist_check": {
      "type": "object",
      "properties": {
        "status": { "type": "string", "enum": ["passed", "duplicate_detected", "override"] },
        "notes": { "type": "string" },
        "duplicate_titles": {
          "type": "array",
          "items": { "type": "string" }
        }
      },
      "required": ["status"]
    },
    "design_system": {
      "type": "object",
      "properties": {
        "background_color": { "type": "string", "description": "Global background color or tone, e.g., '#08050a' or 'dark moody studio background'" },
        "lighting_style": { "type": "string", "description": "Global lighting constraints, e.g., 'chiaroscuro, strong specular highlights'" },
        "global_mood": { "type": "string", "description": "Overall vibe, e.g., 'High-end luxury'" }
      },
      "required": ["background_color", "lighting_style", "global_mood"],
      "description": "Visual constraints locked before generating any assets"
    },
    "beat_plan": {
      "type": "array",
      "items": {
        "type": "object",
        "properties": {
          "scene_name": { "type": "string" },
          "garment_concept": { "type": "string" },
          "composition_rule": { "type": "string", "description": "DOM layout rule for HyperFrames (e.g., 'Position asset in left flex column, text in right'). DO NOT bake spatial layout into image prompts." },
          "motion_rule": { "type": "string", "description": "Camera or subject motion, e.g., 'subtle pan left to match HTML entry'" }
        },
        "required": ["scene_name", "composition_rule"]
      },
      "description": "Scene-by-scene composition and layout rules"
    },
    "metadata": { "type": "object" }
  },
  "additionalProperties": false
}
